{
  "candidate": "clean-room-contract-skills-003",
  "track": "contract-plus-skills",
  "generatedBy": "GPT-5 Codex",
  "cleanRoom": true,
  "allowedInputs": [
    "benchmarks/component-fidelity/status-badge/clean-room/prompt.md",
    "benchmarks/component-fidelity/status-badge/clean-room/allowed-inputs.json",
    "benchmarks/component-fidelity/status-badge/clean-room/candidate.schema.json",
    "README.md",
    "AGENTS.md",
    "DESIGN.md",
    ".design/AGENT.md",
    ".design/INDEX.md",
    ".design/components/DATA-DISPLAY.md",
    ".design/components/FEEDBACK-OVERLAYS.md",
    ".design/global/CONTENT.md",
    ".design/global/INTERACTION.md",
    ".design/verticals/web/BASE.md",
    ".design/verticals/web/APP.md",
    "templates/design/PROJECT.md",
    "templates/design/COMPONENTS.md",
    "templates/design/REFERENCES.md",
    "templates/design/COMPOSITION.json",
    "skills/design-system/SKILL.md",
    "skills/design-review/SKILL.md"
  ],
  "provenance": {
    "runId": "0241bb6a-b77f-40c6-b062-715c8d19a0c9",
    "model": "GPT-5 Codex",
    "operator": "Codex",
    "generatedAt": "2026-07-22T21:41:07.5797356-04:00",
    "targetAccess": false,
    "promptSha256": "d7105c30b7a207cb628fd2975ee383acab85b818a9eb7b6774ae72ace8fcb578",
    "allowedInputsSha256": "d96887b65e389ffab9c5065bb434a6b10cab3e562c99776dff0a63ddc7032ec4",
    "allowedInputFiles": [
      "benchmarks/component-fidelity/status-badge/clean-room/prompt.md",
      "benchmarks/component-fidelity/status-badge/clean-room/allowed-inputs.json",
      "benchmarks/component-fidelity/status-badge/clean-room/candidate.schema.json",
      "README.md",
      "AGENTS.md",
      "DESIGN.md",
      ".design/AGENT.md",
      ".design/INDEX.md",
      ".design/components/DATA-DISPLAY.md",
      ".design/components/FEEDBACK-OVERLAYS.md",
      ".design/global/CONTENT.md",
      ".design/global/INTERACTION.md",
      ".design/verticals/web/BASE.md",
      ".design/verticals/web/APP.md",
      "templates/design/PROJECT.md",
      "templates/design/COMPONENTS.md",
      "templates/design/REFERENCES.md",
      "templates/design/COMPOSITION.json",
      "skills/design-system/SKILL.md",
      "skills/design-review/SKILL.md"
    ],
    "cleanRoomAttestation": "I did not read the hidden target, prior candidates, benchmark output, scorer output, scorer misses, or files outside the allowed contract-plus-skills inputs."
  },
  "anatomy": [
    "badge.root",
    "badge.status-dot",
    "badge.label",
    "badge.focus-ring"
  ],
  "tokens": {
    "height": 24,
    "paddingInline": 8,
    "gap": 4,
    "radius": 999,
    "background": "#FFF1D6",
    "foreground": "#7A5417",
    "border": "rgba(67, 52, 38, 0.15)",
    "dotColor": "#7A5417",
    "fontFamily": "Inter",
    "fontWeight": 500,
    "labelSize": 12,
    "dotSize": 6
  },
  "states": {
    "hover": {
      "background": "#FFF1D6",
      "border": "rgba(67, 52, 38, 0.22)"
    },
    "focusVisible": {
      "outlineWidth": 2,
      "outlineColor": "#7D4936",
      "outlineOffset": 2
    },
    "disabled": {
      "background": "#FAF5EC",
      "foreground": "#766E65",
      "opacity": 0.72
    }
  },
  "content": {
    "label": "Needs review",
    "ariaLabel": "Status: Needs review"
  }
}
