{
  "candidate": "clean-room-contract-skills-001",
  "track": "contract-plus-skills",
  "generatedBy": "GPT-5 Codex",
  "cleanRoom": true,
  "allowedInputs": [
    "benchmarks/component-fidelity/approval-badge/clean-room/prompt.md",
    "benchmarks/component-fidelity/approval-badge/clean-room/allowed-inputs.json",
    "benchmarks/component-fidelity/approval-badge/clean-room/candidate.schema.json",
    "README.md",
    "AGENTS.md",
    "DESIGN.md",
    ".design/AGENT.md",
    ".design/INDEX.md",
    ".design/components/DATA-DISPLAY.md",
    ".design/components/FEEDBACK-OVERLAYS.md",
    ".design/global/CONTENT.md",
    ".design/global/INTERACTION.md",
    ".design/verticals/web/BASE.md",
    ".design/verticals/web/APP.md",
    "templates/design/PROJECT.md",
    "templates/design/COMPONENTS.md",
    "templates/design/REFERENCES.md",
    "templates/design/COMPOSITION.json",
    "skills/design-system/SKILL.md",
    "skills/design-review/SKILL.md"
  ],
  "provenance": {
    "runId": "clean-room-contract-skills-001-2026-07-22T21-49-12-04-00",
    "model": "GPT-5 Codex",
    "operator": "Codex",
    "generatedAt": "2026-07-22T21:49:12.4307880-04:00",
    "targetAccess": false,
    "promptSha256": "8a69c3414039e0eb8df4f6ba92af48c062c634df50b46817c5e8569f20994a31",
    "allowedInputsSha256": "fc3cab398cf9dafbfa6956bf504ba9222de87f985acfd827a8faa8325922774a",
    "allowedInputFiles": [
      "benchmarks/component-fidelity/approval-badge/clean-room/prompt.md",
      "benchmarks/component-fidelity/approval-badge/clean-room/allowed-inputs.json",
      "benchmarks/component-fidelity/approval-badge/clean-room/candidate.schema.json",
      "README.md",
      "AGENTS.md",
      "DESIGN.md",
      ".design/AGENT.md",
      ".design/INDEX.md",
      ".design/components/DATA-DISPLAY.md",
      ".design/components/FEEDBACK-OVERLAYS.md",
      ".design/global/CONTENT.md",
      ".design/global/INTERACTION.md",
      ".design/verticals/web/BASE.md",
      ".design/verticals/web/APP.md",
      "templates/design/PROJECT.md",
      "templates/design/COMPONENTS.md",
      "templates/design/REFERENCES.md",
      "templates/design/COMPOSITION.json",
      "skills/design-system/SKILL.md",
      "skills/design-review/SKILL.md"
    ],
    "cleanRoomAttestation": "I did not read the hidden target, prior candidates, benchmark output, scorer output, scorer misses, or files outside the allowed contract-plus-skills inputs."
  },
  "anatomy": [
    "badge.root",
    "badge.status-dot",
    "badge.label",
    "badge.focus-ring"
  ],
  "tokens": {
    "height": 24,
    "paddingInline": 8,
    "gap": 4,
    "radius": 999,
    "background": "#E8F2E7",
    "foreground": "#356548",
    "border": "rgba(67, 52, 38, 0.15)",
    "dotColor": "#356548",
    "fontFamily": "Inter",
    "fontWeight": 500,
    "labelSize": 12,
    "dotSize": 6
  },
  "states": {
    "hover": {
      "background": "#E8F2E7",
      "border": "rgba(67, 52, 38, 0.22)"
    },
    "focusVisible": {
      "outlineWidth": 2,
      "outlineColor": "#7D4936",
      "outlineOffset": 2
    },
    "disabled": {
      "background": "#FAF5EC",
      "foreground": "#766E65",
      "opacity": 0.72
    }
  },
  "content": {
    "label": "Approved",
    "ariaLabel": "Status: Approved"
  }
}
